{
  "notebook_id": "8_6_atp_star_from_scratch",
  "section": "8.6",
  "title": "AtP* from Scratch",
  "date_run": "2026-09-05T00:22:33.584025+00:00",
  "git_commit": "8eab192b",
  "gt_tier": "GT-0",
  "evidence_level": "exact_nonlinear_ground_truth_plus_pinned_transformerlens_qk_component_study",
  "claim_scope": "An exact eight-site nonlinear model organism proves that clean-point first-order attribution can miss saturated Q/K sites and an exactly cancelling source. The AtP* Q/K softmax correction and GradDrop recover the exact toy ranking. A pinned Pythia-70M study over 24 grammar pairs compares exact patching, vanilla AtP, AtP*, same-size random circuits, clean-pair shuffling, and label shuffling across 96 named final-position Q/K sites. The distinct EAP-style baseline is toy-only. This is component-level ranking evidence, not a complete circuit interpretation.",
  "models": [
    {
      "id": "exact_nonlinear_atp_star_toy_v1",
      "source": "generated_analytic_model",
      "revision": "saturated_attention_plus_exact_cancellation_v1",
      "precision": "float64",
      "gated": false
    },
    {
      "id": "EleutherAI/pythia-70m-deduped",
      "source": "huggingface_via_transformerlens",
      "revision": "e93a9faa9c77e5d09219f6c868bfc7a1bd65593c",
      "precision": "float32",
      "gated": false,
      "transformerlens_model_name": "pythia-70m-deduped",
      "claim_scope": "final_position_rotary_qk_component_ranking"
    }
  ],
  "datasets": [
    {
      "id": "exact_nonlinear_atp_star_toy_inputs_v1",
      "source": "generated_analytic_task",
      "seed": "deterministic",
      "candidate_components": 8
    },
    {
      "id": "fixed_grammar_agreement_pairs_v1",
      "source": "generated_counterfactual_pairs",
      "seed": "deterministic",
      "examples": 24,
      "task_families": [
        "copula",
        "possession",
        "agreement"
      ]
    }
  ],
  "tests_passed": true,
  "metrics": {
    "toy": {
      "accepted": true,
      "clean_metric": 2.8999999543100614,
      "corrupt_metric": 0.0,
      "exact_effects": {
        "L0H0.Q@dest": -2.999999908620123,
        "L0H0.K@signal": -1.4999999543100615,
        "L0H0.K@decoy": -1.4999999543100615,
        "L0H0.V@signal": -1.999999969540041,
        "L0H0.V@decoy": 1.5229979499764568e-08,
        "L0M0.cancel_source": -0.5,
        "L1M0.linear_source": -0.3999999999999999,
        "L1M1.null_source": 0.0
      },
      "vanilla_atp": {
        "L0H0.Q@dest": -1.6448377616255e-06,
        "L0H0.K@signal": -8.224188804618638e-07,
        "L0H0.K@decoy": -8.22418881163636e-07,
        "L0H0.V@signal": -1.999999969540041,
        "L0H0.V@decoy": 1.522997951276035e-08,
        "L0M0.cancel_source": -0.0,
        "L1M0.linear_source": -0.4,
        "L1M1.null_source": -0.0
      },
      "atp_star": {
        "L0H0.Q@dest": 2.999999908620123,
        "L0H0.K@signal": 1.4999999543100615,
        "L0H0.K@decoy": 1.4999999543100615,
        "L0H0.V@signal": 1.999999969540041,
        "L0H0.V@decoy": 1.522997951276035e-08,
        "L0M0.cancel_source": 0.5,
        "L1M0.linear_source": 0.4,
        "L1M1.null_source": 0.0
      },
      "grad_drop_estimates": {
        "attention": {
          "L0H0.Q@dest": 0.0,
          "L0H0.K@signal": 0.0,
          "L0H0.K@decoy": 0.0,
          "L0H0.V@signal": -0.0,
          "L0H0.V@decoy": 0.0,
          "L0M0.cancel_source": -0.0,
          "L1M0.linear_source": -0.4,
          "L1M1.null_source": -0.0
        },
        "cancellation": {
          "L0H0.Q@dest": -2.999999908620123,
          "L0H0.K@signal": -1.4999999543100615,
          "L0H0.K@decoy": -1.4999999543100615,
          "L0H0.V@signal": -1.999999969540041,
          "L0H0.V@decoy": 1.522997951276035e-08,
          "L0M0.cancel_source": -1.0,
          "L1M0.linear_source": -0.4,
          "L1M1.null_source": -0.0
        },
        "linear": {
          "L0H0.Q@dest": -2.999999908620123,
          "L0H0.K@signal": -1.4999999543100615,
          "L0H0.K@decoy": -1.4999999543100615,
          "L0H0.V@signal": -1.999999969540041,
          "L0H0.V@decoy": 1.522997951276035e-08,
          "L0M0.cancel_source": -0.0,
          "L1M0.linear_source": -0.0,
          "L1M1.null_source": -0.0
        }
      },
      "eap_edges": {
        "Q -> signal_logit": -8.224188804618637e-07,
        "Q -> decoy_logit": -8.224188811636359e-07,
        "K_signal -> signal_logit": -8.224188804618637e-07,
        "K_decoy -> decoy_logit": -8.224188811636359e-07,
        "V_signal -> attention_output": -1.999999969540041,
        "V_decoy -> attention_output": 1.522997951276035e-08,
        "cancel_source -> direct_output": -0.0,
        "cancel_source -> cancellation_output": 1.0,
        "linear_source -> linear_output": -0.4,
        "null_source -> metric": 0.0
      },
      "eap_by_component": {
        "L0H0.Q@dest": 1.6448377616254995e-06,
        "L0H0.K@signal": 8.224188804618637e-07,
        "L0H0.K@decoy": 8.224188811636359e-07,
        "L0H0.V@signal": 1.999999969540041,
        "L0H0.V@decoy": 1.522997951276035e-08,
        "L0M0.cancel_source": 1.0,
        "L1M0.linear_source": 0.4,
        "L1M1.null_source": 0.0
      },
      "reports": {
        "Exact patching": {
          "method": "Exact patching",
          "ranking": [
            "L0H0.Q@dest",
            "L0H0.V@signal",
            "L0H0.K@decoy",
            "L0H0.K@signal",
            "L0M0.cancel_source",
            "L1M0.linear_source",
            "L0H0.V@decoy",
            "L1M1.null_source"
          ],
          "spearman": 0.9999999999999998,
          "recovery_at_k": [
            0.33707864891665557,
            0.5617977516168934,
            0.730337076075221,
            0.8988764005335488,
            0.9550561770642251,
            0.9999999982887662,
            0.9999999999999998,
            0.9999999999999998
          ],
          "faithfulness_at_k": [
            1.0344827434088193,
            1.0344827539122536,
            0.8620689633441171,
            0.6896551727759805,
            0.8620689685958343,
            1.000000005251717,
            1.0,
            1.0
          ],
          "wall_time_ms": 0.09956900066754315,
          "estimated_tensor_bytes": 256,
          "forward_passes": 3,
          "backward_passes": 0
        },
        "Vanilla AtP": {
          "method": "Vanilla AtP",
          "ranking": [
            "L0H0.V@signal",
            "L1M0.linear_source",
            "L0H0.Q@dest",
            "L0H0.K@decoy",
            "L0H0.K@signal",
            "L0H0.V@decoy",
            "L0M0.cancel_source",
            "L1M1.null_source"
          ],
          "spearman": 0.6265060240963854,
          "recovery_at_k": [
            0.22471910270023776,
            0.26966292392477875,
            0.6067415728414344,
            0.7752808972997621,
            0.9438202217580899,
            0.9438202234693235,
            0.9999999999999998,
            0.9999999999999998
          ],
          "faithfulness_at_k": [
            0.6896551727759805,
            0.8275862094318635,
            1.1724137905681367,
            1.0,
            0.8275862094318635,
            0.8275862041801463,
            1.0,
            1.0
          ],
          "wall_time_ms": 0.09835400032898178,
          "estimated_tensor_bytes": 128,
          "forward_passes": 2,
          "backward_passes": 1
        },
        "AtP*": {
          "method": "AtP*",
          "ranking": [
            "L0H0.Q@dest",
            "L0H0.V@signal",
            "L0H0.K@decoy",
            "L0H0.K@signal",
            "L0M0.cancel_source",
            "L1M0.linear_source",
            "L0H0.V@decoy",
            "L1M1.null_source"
          ],
          "spearman": 0.9999999999999998,
          "recovery_at_k": [
            0.33707864891665557,
            0.5617977516168934,
            0.730337076075221,
            0.8988764005335488,
            0.9550561770642251,
            0.9999999982887662,
            0.9999999999999998,
            0.9999999999999998
          ],
          "faithfulness_at_k": [
            1.0344827434088193,
            1.0344827539122536,
            0.8620689633441171,
            0.6896551727759805,
            0.8620689685958343,
            1.000000005251717,
            1.0,
            1.0
          ],
          "wall_time_ms": 0.3663750003397581,
          "estimated_tensor_bytes": 256,
          "forward_passes": 2,
          "backward_passes": 3
        },
        "EAP-style": {
          "method": "EAP-style",
          "ranking": [
            "L0H0.V@signal",
            "L0M0.cancel_source",
            "L1M0.linear_source",
            "L0H0.Q@dest",
            "L0H0.K@decoy",
            "L0H0.K@signal",
            "L0H0.V@decoy",
            "L1M1.null_source"
          ],
          "spearman": 0.5628843430992316,
          "recovery_at_k": [
            0.22471910270023776,
            0.28089887923091406,
            0.32584270045545505,
            0.6629213493721107,
            0.8314606738304384,
            0.9999999982887662,
            0.9999999999999998,
            0.9999999999999998
          ],
          "faithfulness_at_k": [
            0.6896551727759805,
            0.8620689685958343,
            1.000000005251717,
            1.3448275863879902,
            1.1724137958198537,
            1.000000005251717,
            1.0,
            1.0
          ],
          "wall_time_ms": 0.11696000001393259,
          "estimated_tensor_bytes": 192,
          "forward_passes": 2,
          "backward_passes": 1
        },
        "Random": {
          "method": "Random",
          "ranking": [
            "L1M1.null_source",
            "L1M0.linear_source",
            "L0M0.cancel_source",
            "L0H0.V@decoy",
            "L0H0.V@signal",
            "L0H0.K@decoy",
            "L0H0.K@signal",
            "L0H0.Q@dest"
          ],
          "spearman": -0.8503146459584138,